{
  "schema_version": 1,
  "id": "fastdds-native-denied-observer",
  "title": "Denied participant remains present during protected endpoint key distribution",
  "implementation": {
    "name": "fastdds",
    "version": "3.6.2"
  },
  "domain_id": 225,
  "participants": {
    "mallory": {
      "role": "denied_observer",
      "identity": {
        "subject": "/CN=denied-observer/O=DDSleuth"
      },
      "permissions": {
        "subscribe": []
      }
    },
    "reader": {
      "role": "authorized_reader",
      "identity": {
        "subject": "/CN=authorized-reader/O=DDSleuth"
      },
      "permissions": {
        "subscribe": ["ProtectedObservedTopic"]
      }
    },
    "writer": {
      "role": "authorized_writer",
      "identity": {
        "subject": "/CN=authorized-writer/O=DDSleuth"
      },
      "permissions": {
        "publish": ["ProtectedObservedTopic"]
      }
    }
  },
  "policy": {
    "grant_order": ["mallory", "reader", "writer"]
  },
  "governance": {
    "allow_unauthenticated_participants": false,
    "enable_join_access_control": true,
    "discovery_protection": "encrypt",
    "liveliness_protection": "encrypt",
    "rtps_protection": "encrypt"
  },
  "topics": {
    "ProtectedObservedTopic": {
      "enable_discovery_protection": true,
      "enable_liveliness_protection": true,
      "enable_read_access_control": true,
      "enable_write_access_control": true,
      "metadata_protection": "encrypt_with_origin_authentication",
      "data_protection": "encrypt"
    }
  },
  "assertions": [
    {
      "id": "INV-OBSERVER-HEALTH-01",
      "oracle": "observer_health",
      "parameters": {}
    },
    {
      "id": "INV-POLICY-01",
      "oracle": "policy_authorization_consistency",
      "parameters": {}
    },
    {
      "id": "INV-UNAUTHORIZED-KEY-01",
      "oracle": "unauthorized_key_disclosure",
      "parameters": {
        "actor": "mallory"
      }
    },
    {
      "id": "INV-RECIPIENT-01",
      "oracle": "crypto_token_recipient_binding",
      "parameters": {}
    },
    {
      "id": "INV-TRANSPORT-01",
      "oracle": "crypto_token_transport_consistency",
      "parameters": {
        "require_all_generated": true
      }
    },
    {
      "id": "INV-KEY-SCOPE-01",
      "oracle": "key_scope_separation",
      "parameters": {
        "scope_attribute": "destination_participant_guid",
        "observation_phase": "received",
        "endpoint_class": "user"
      }
    }
  ],
  "execution": {
    "network": "loopback",
    "timeout_seconds": 40,
    "log_format": "ddssec-jsonl",
    "roles": [
      {
        "actor": "mallory",
        "command": [
          "${DDSLEUTH_FASTDDS_NATIVE_PROBE}",
          "mallory",
          "observe-denied-reader",
          "225",
          "ProtectedObservedTopic",
          "8000",
          "deny"
        ],
        "environment": {
          "ASAN_OPTIONS": "detect_leaks=0",
          "DDSLEUTH_FASTDDS_OBSERVER": "1"
        }
      },
      {
        "actor": "reader",
        "command": [
          "${DDSLEUTH_FASTDDS_NATIVE_PROBE}",
          "reader",
          "reader",
          "225",
          "ProtectedObservedTopic",
          "20000",
          "allow"
        ],
        "environment": {
          "ASAN_OPTIONS": "detect_leaks=0",
          "DDSLEUTH_FASTDDS_OBSERVER": "1"
        },
        "start_after": [
          {
            "actor": "mallory",
            "kind": "probe.ready",
            "outcome": "ready",
            "attributes": {
              "endpoint": "denied-reader",
              "topic": "ProtectedObservedTopic"
            }
          }
        ]
      },
      {
        "actor": "writer",
        "command": [
          "${DDSLEUTH_FASTDDS_NATIVE_PROBE}",
          "writer",
          "writer",
          "225",
          "ProtectedObservedTopic",
          "20000",
          "allow",
          "protected observed delivery"
        ],
        "environment": {
          "ASAN_OPTIONS": "detect_leaks=0",
          "DDSLEUTH_FASTDDS_OBSERVER": "1"
        },
        "start_after": [
          {
            "actor": "reader",
            "kind": "probe.ready",
            "outcome": "ready",
            "attributes": {
              "endpoint": "reader",
              "topic": "ProtectedObservedTopic"
            }
          }
        ]
      }
    ]
  }
}
